{
  "$schema": "../schema/evidence-ledger.schema.json",
  "schema_version": "0.1.0",
  "ledger_id": "EVIDENCELEDGER-ADOS-GLOSSARY-EVOLUTION",
  "source_set_id": "SOURCESET-ADOS-GLOSSARY-EVOLUTION",
  "entries": [
    {
      "evidence_id": "EVD-V13-001",
      "source_id": "SRC-V1.3-RESULT",
      "evidence_class": "observed",
      "locator": "prior evaluation metrics",
      "observation": "The v1.3 package had 42 declared instance/schema bindings and all 42 passed in the supplied evaluation.",
      "procedure": "Review supplied artifact or prior evaluation output.",
      "expected": "Record the relevant observed condition without extending its scope.",
      "captured_at_utc": "2026-06-18T00:00:00Z",
      "verifier": "quality-drift evaluator",
      "independence": "independent_logic",
      "artifact_sha256": null,
      "supports_claim_ids": [
        "CLM-V13-001"
      ],
      "status": "verified"
    },
    {
      "evidence_id": "EVD-V13-002",
      "source_id": "SRC-V1.3-RESULT",
      "evidence_class": "observed",
      "locator": "prior evaluation metrics",
      "observation": "The v1.3 glossary, concept matrix, and SKOS surfaces represented the same 109 terms in the supplied comparison.",
      "procedure": "Review supplied artifact or prior evaluation output.",
      "expected": "Record the relevant observed condition without extending its scope.",
      "captured_at_utc": "2026-06-18T00:00:00Z",
      "verifier": "quality-drift evaluator",
      "independence": "independent_logic",
      "artifact_sha256": null,
      "supports_claim_ids": [
        "CLM-V13-002"
      ],
      "status": "verified"
    },
    {
      "evidence_id": "EVD-V13-003",
      "source_id": "SRC-V1.3-RESULT",
      "evidence_class": "judgment",
      "locator": "prior whole-document evaluation",
      "observation": "The v1.3 whole-document score was 74.32 and it was selected as the strongest baseline.",
      "procedure": "Review supplied artifact or prior evaluation output.",
      "expected": "Record the relevant observed condition without extending its scope.",
      "captured_at_utc": "2026-06-18T00:00:00Z",
      "verifier": "quality-drift evaluator",
      "independence": "independent_logic",
      "artifact_sha256": null,
      "supports_claim_ids": [
        "CLM-V13-003"
      ],
      "status": "verified"
    },
    {
      "evidence_id": "EVD-V14-001",
      "source_id": "SRC-V1.4-RESULT",
      "evidence_class": "observed",
      "locator": "prior package inspection",
      "observation": "v1.4 added a more extensive registry, schema, generated, project, and tools structure.",
      "procedure": "Review supplied artifact or prior evaluation output.",
      "expected": "Record the relevant observed condition without extending its scope.",
      "captured_at_utc": "2026-06-18T00:00:00Z",
      "verifier": "quality-drift evaluator",
      "independence": "independent_logic",
      "artifact_sha256": null,
      "supports_claim_ids": [
        "CLM-V14R-001"
      ],
      "status": "verified"
    },
    {
      "evidence_id": "EVD-V14-002",
      "source_id": "SRC-V1.4-RESULT",
      "evidence_class": "observed",
      "locator": "adversarial validator run",
      "observation": "The v1.4 validator accepted seven representative severe mutations.",
      "procedure": "Review supplied artifact or prior evaluation output.",
      "expected": "Record the relevant observed condition without extending its scope.",
      "captured_at_utc": "2026-06-18T00:00:00Z",
      "verifier": "quality-drift evaluator",
      "independence": "independent_logic",
      "artifact_sha256": null,
      "supports_claim_ids": [
        "CLM-V14R-002"
      ],
      "status": "verified"
    },
    {
      "evidence_id": "EVD-V14-003",
      "source_id": "SRC-V1.4-RESULT",
      "evidence_class": "observed",
      "locator": "work-plan inspection",
      "observation": "The twelve work items did not contain usable target grounding.",
      "procedure": "Review supplied artifact or prior evaluation output.",
      "expected": "Record the relevant observed condition without extending its scope.",
      "captured_at_utc": "2026-06-18T00:00:00Z",
      "verifier": "quality-drift evaluator",
      "independence": "independent_logic",
      "artifact_sha256": null,
      "supports_claim_ids": [
        "CLM-V14R-003"
      ],
      "status": "verified"
    },
    {
      "evidence_id": "EVD-V14-004",
      "source_id": "SRC-V1.4-RESULT",
      "evidence_class": "observed",
      "locator": "semantic comparison",
      "observation": "New term records were not fully synchronized to concept matrix and SKOS outputs.",
      "procedure": "Review supplied artifact or prior evaluation output.",
      "expected": "Record the relevant observed condition without extending its scope.",
      "captured_at_utc": "2026-06-18T00:00:00Z",
      "verifier": "quality-drift evaluator",
      "independence": "independent_logic",
      "artifact_sha256": null,
      "supports_claim_ids": [
        "CLM-V14R-004"
      ],
      "status": "verified"
    },
    {
      "evidence_id": "EVD-V14-005",
      "source_id": "SRC-V1.4-BUILD-PACKAGE",
      "evidence_class": "observed",
      "locator": "closure prompt",
      "observation": "The closure prompt explicitly targeted identity, schema-instance alignment, inventory, stale evidence, validator coverage, and external Reflection proof defects.",
      "procedure": "Review supplied artifact or prior evaluation output.",
      "expected": "Record the relevant observed condition without extending its scope.",
      "captured_at_utc": "2026-06-18T00:00:00Z",
      "verifier": "quality-drift evaluator",
      "independence": "builder_owned",
      "artifact_sha256": null,
      "supports_claim_ids": [
        "CLM-V14B-001",
        "CLM-V14B-002"
      ],
      "status": "verified"
    },
    {
      "evidence_id": "EVD-CALC-001",
      "source_id": "SRC-V1.4-AGENT",
      "evidence_class": "observed",
      "locator": "calculator test record",
      "observation": "The calculator fixture passed six arithmetic and division-by-zero tests.",
      "procedure": "Review supplied artifact or prior evaluation output.",
      "expected": "Record the relevant observed condition without extending its scope.",
      "captured_at_utc": "2026-06-18T00:00:00Z",
      "verifier": "quality-drift evaluator",
      "independence": "builder_owned",
      "artifact_sha256": null,
      "supports_claim_ids": [
        "CLM-V14A-001",
        "CLM-V15A-003"
      ],
      "status": "verified"
    },
    {
      "evidence_id": "EVD-V15B-001",
      "source_id": "SRC-V1.5-BUILD-PACKAGE",
      "evidence_class": "observed",
      "locator": "v1.5 PDD and ADR controls",
      "observation": "The control pack required one-file work, complete JSON governance, strict critical schemas, generic Reflection QA, and clean-extraction downstream proof.",
      "procedure": "Review supplied artifact or prior evaluation output.",
      "expected": "Record the relevant observed condition without extending its scope.",
      "captured_at_utc": "2026-06-18T00:00:00Z",
      "verifier": "quality-drift evaluator",
      "independence": "builder_owned",
      "artifact_sha256": null,
      "supports_claim_ids": [
        "CLM-V15B-001",
        "CLM-V15B-002",
        "CLM-V15B-003"
      ],
      "status": "verified"
    },
    {
      "evidence_id": "EVD-V15A-001",
      "source_id": "SRC-V1.5-AGENT",
      "evidence_class": "observed",
      "locator": "activity sequence",
      "observation": "External proof artifacts were created through build logic before the final v1.5 package was completed.",
      "procedure": "Review supplied artifact or prior evaluation output.",
      "expected": "Record the relevant observed condition without extending its scope.",
      "captured_at_utc": "2026-06-18T00:00:00Z",
      "verifier": "quality-drift evaluator",
      "independence": "independent_logic",
      "artifact_sha256": null,
      "supports_claim_ids": [
        "CLM-V15A-001"
      ],
      "status": "verified"
    },
    {
      "evidence_id": "EVD-V15A-002",
      "source_id": "SRC-V1.5-AGENT",
      "evidence_class": "observed",
      "locator": "generated evidence inspection",
      "observation": "Work verification records chiefly asserted PASS and target paths without full observation-bearing evidence fields.",
      "procedure": "Review supplied artifact or prior evaluation output.",
      "expected": "Record the relevant observed condition without extending its scope.",
      "captured_at_utc": "2026-06-18T00:00:00Z",
      "verifier": "quality-drift evaluator",
      "independence": "independent_logic",
      "artifact_sha256": null,
      "supports_claim_ids": [
        "CLM-V15A-002"
      ],
      "status": "verified"
    },
    {
      "evidence_id": "EVD-V15A-003",
      "source_id": "SRC-V1.5-SUMMARY",
      "evidence_class": "observed",
      "locator": "self-reported build summary",
      "observation": "The build summary reported PASS, 161 files, 33 approved ADRs, 103 Atomic Works, and no blockers.",
      "procedure": "Review supplied artifact or prior evaluation output.",
      "expected": "Record the relevant observed condition without extending its scope.",
      "captured_at_utc": "2026-06-18T00:00:00Z",
      "verifier": "quality-drift evaluator",
      "independence": "builder_owned",
      "artifact_sha256": null,
      "supports_claim_ids": [
        "CLM-V15A-003",
        "CLM-V15R-001"
      ],
      "status": "verified"
    },
    {
      "evidence_id": "EVD-V15R-001",
      "source_id": "SRC-V1.5-RESULT",
      "evidence_class": "observed",
      "locator": "adversarial validator run",
      "observation": "The v1.5 validator accepted five severe mutations affecting evidence, work status, semantic consistency, Reflection references, and proof identity or hashes.",